{
  "schemaVersion": 1,
  "phase": "phase-d-native-operator",
  "defaultPolicy": "Retirement is stage-driven under the composition cutover (DR-2026-08-04-b): a row flips to `deleted` in the PR train that deletes its machinery, citing Class A evidence; there is no default flip",
  "transitions": [
    {
      "id": "legacy-operator-composition",
      "owner": "client operator composition",
      "entryPoints": [
        "operator/src/daemon/daemon.ts",
        "operator/src/daemon/native-vertical-mode.ts",
        "operator/src/daemon/operator-host-factory.ts"
      ],
      "replacement": "The single jinn run entry (operator/src/main.ts) with compositionMode native fleet composition.",
      "consumers": [],
      "defaultMode": "legacy",
      "noNewUseGuard": {
        "path": ".github/scripts/phase-d-transition-deletion.test.mjs",
        "assertion": "Exactly one operator product graph is selected and native mode cannot load legacy restoration, work-loop, or compatibility composition."
      },
      "usageSignal": {
        "name": "legacy-operator-composition",
        "sourceFile": "operator/src/compatibility/phase-d-transition-usage.ts",
        "sourceDescription": "durable counters exposed by GET /v1/status; the increment at daemon construction retired with the native-v1 parallel entry (Stage 5 PR 2 / D5)",
        "zeroDefinition": "No production instance selects the legacy graph during the approved observation window."
      },
      "migration": {
        "description": "Complete native requester, solver, evaluator, public-source, recovery, and settlement closure before changing the default.",
        "compatibility": "Explicit legacy and native-v1 modes remain accepted throughout Phase C; absent configuration still selects legacy."
      },
      "sunsetCondition": {
        "description": "Native is the proven default and every durable native operation is resolved.",
        "evidence": [
          "exact merged-SHA Base Sepolia closure receipt",
          "zero unresolved native operations",
          "zero legacy-mode use for the approved observation window"
        ]
      },
      "deletionTest": {
        "path": ".github/scripts/phase-d-transition-deletion.test.mjs",
        "command": "node --test .github/scripts/phase-d-transition-deletion.test.mjs"
      },
      "targetPullRequest": "Stage 5 PR 2 (D5 native-v1 parallel entry)",
      "status": "deleted",
      "evidenceCitation": "log/decisions/2026-08-05-cutover-one-swap-collapse.md"
    },
    {
      "id": "marketplace-pipeline",
      "owner": "marketplace legacy compatibility",
      "entryPoints": [
        "packages/marketplace/pipeline/src/index.ts",
        "operator/src/daemon/work-loop.ts"
      ],
      "replacement": "Native tier-4 claim policy plus marketplace binding and task-execution backend capabilities.",
      "consumers": [
        "operator/src/config/shape-v2.ts",
        "operator/src/daemon/composition-root.ts",
        "operator/src/daemon/engagement-ledger.ts",
        "operator/src/main.ts"
      ],
      "defaultMode": "legacy",
      "noNewUseGuard": {
        "path": ".github/scripts/marketplace-source-boundaries.test.mjs",
        "assertion": "Only the frozen legacy client import allowlist may import marketplace-pipeline."
      },
      "usageSignal": {
        "name": "marketplace-pipeline-invocation",
        "sourceFile": "operator/src/compatibility/phase-d-transition-usage.ts",
        "sourceDescription": "durable counter exposed by GET /v1/status and instrumented at the legacy runPipeline call (operator/src/daemon/work-loop.ts:466)",
        "zeroDefinition": "No production runPipeline invocation occurs during the approved observation window."
      },
      "migration": {
        "description": "Native consumers use neutral task-execution backend helpers and native submission facts; no reusable consumer imports pipeline.",
        "compatibility": "The deprecated root export corpus remains behavior-frozen for the legacy work loop until Phase D2."
      },
      "sunsetCondition": {
        "description": "No runtime dependency or invocation remains after the native default is proven.",
        "evidence": [
          "zero non-legacy imports",
          "zero production invocations",
          "legacy client dependency removed"
        ]
      },
      "deletionTest": {
        "path": ".github/scripts/phase-d-transition-deletion.test.mjs",
        "command": "node --test .github/scripts/phase-d-transition-deletion.test.mjs"
      },
      "targetPullRequest": "Phase D2 pipeline deletion",
      "status": "migrating"
    },
    {
      "id": "legacy-task-submission-synthesis",
      "owner": "client legacy projector bridge",
      "entryPoints": [
        "operator/src/daemon/bridge-legacy-delivery.ts",
        "operator/src/daemon/projector-enrich.ts"
      ],
      "replacement": "Native exact Task and Submission records obtained through verified Record Discovery entries.",
      "consumers": [
        "operator/src/adapters/mech/adapter.ts",
        "operator/src/daemon/archive-subscription.ts",
        "operator/src/daemon/composition-root.ts",
        "operator/src/daemon/work-loop-corpus.ts"
      ],
      "defaultMode": "legacy",
      "noNewUseGuard": {
        "path": ".github/scripts/phase-d-transition-deletion.test.mjs",
        "assertion": "Legacy synthesis remains confined to the two declared bridge entry points and carries derivationKind legacy."
      },
      "usageSignal": {
        "name": "legacy-task-submission-synthesis",
        "sourceFile": "operator/src/compatibility/phase-d-transition-usage.ts",
        "sourceDescription": "durable counter exposed by GET /v1/status and instrumented at legacy Task/Submission synthesis (operator/src/daemon/bridge-legacy-delivery.ts:126)",
        "zeroDefinition": "No synthesized legacy Task or Submission card is produced during the approved observation window."
      },
      "migration": {
        "description": "Require exact native Task and Submission bytes and canonical associations for all native work.",
        "compatibility": "Legacy SignedTaskV1 fixtures and synthesis stay frozen while legacy mode is supported."
      },
      "sunsetCondition": {
        "description": "All production Task and Submission joins use exact native records.",
        "evidence": [
          "zero synthesized-card usage",
          "zero bridge imports outside archival tests"
        ]
      },
      "deletionTest": {
        "path": ".github/scripts/phase-d-transition-deletion.test.mjs",
        "command": "node --test .github/scripts/phase-d-transition-deletion.test.mjs"
      },
      "targetPullRequest": "Phase D3 bridge deletion",
      "status": "planned"
    },
    {
      "id": "legacy-evaluator-delivery-watcher",
      "owner": "client legacy evaluator composition",
      "entryPoints": [
        "operator/src/daemon/delivery-watcher.ts",
        "operator/src/daemon/daemon.ts"
      ],
      "replacement": "Native evaluator composition and its durable evaluation, publication, and verdict-settlement sagas.",
      "consumers": [],
      "defaultMode": "legacy",
      "noNewUseGuard": {
        "path": ".github/scripts/phase-d-transition-deletion.test.mjs",
        "assertion": "Native daemon construction rejects the legacy restoration and compatibility components."
      },
      "usageSignal": {
        "name": "legacy-evaluator-delivery-watcher-loaded",
        "sourceFile": "operator/src/compatibility/phase-d-transition-usage.ts",
        "sourceDescription": "durable counter exposed by GET /v1/status; it was instrumented on legacy delivery-watcher load until Wave-4 D2 deleted the watcher, and is no longer recorded. The name stays in the signal vocabulary so an already-written durable observation file carrying the counter still validates.",
        "zeroDefinition": "No legacy delivery watcher or evaluator component is loaded during the approved observation window."
      },
      "migration": {
        "description": "Prove native evaluation, publication, and verdict settlement before removing the legacy watcher.",
        "compatibility": "None remains: the watcher and the mech adapter's evaluation-opportunity machinery are deleted, and no composition can reach them."
      },
      "sunsetCondition": {
        "description": "Native evaluation closure is green and legacy components have zero measured load.",
        "evidence": [
          "finalized native verdict settlement",
          "zero legacy component loads"
        ]
      },
      "deletionTest": {
        "path": ".github/scripts/phase-d-transition-deletion.test.mjs",
        "command": "node --test .github/scripts/phase-d-transition-deletion.test.mjs"
      },
      "targetPullRequest": "Phase D4 evaluator deletion",
      "status": "deleted",
      "evidenceCitation": "log/decisions/2026-08-05-cutover-one-swap-collapse.md"
    },
    {
      "id": "legacy-wiring-config",
      "owner": "client legacy configuration",
      "entryPoints": [
        "operator/src/config/shape-v2.ts",
        "packages/marketplace/pipeline/src/index.ts"
      ],
      "replacement": "NativeTier4ClaimPolicy and injected native capability, model, harness, plugin, and credential ports.",
      "consumers": [],
      "defaultMode": "legacy",
      "noNewUseGuard": {
        "path": ".github/scripts/marketplace-source-boundaries.test.mjs",
        "assertion": "Native code cannot import marketplace-pipeline wiring or configuration types."
      },
      "usageSignal": {
        "name": "legacy-wiring-config-field",
        "sourceFile": "operator/src/compatibility/phase-d-transition-usage.ts",
        "sourceDescription": "accepted configuration parse diagnostics exposed by GET /v1/status and instrumented in operator/src/config.ts:1480",
        "zeroDefinition": "No accepted production configuration supplies a legacy wiring, model, plugin, or credential field."
      },
      "migration": {